{
  "schema_version": 1,
  "project_id": "sample-app",
  "identity_lineage": [],
  "repositories": [],
  "constraints": [],
  "domains": [
    {
      "id": "wiki-workspace",
      "kind": "capability",
      "label": { "en": "Wiki workspace", "zh-CN": "Wiki 工作区" },
      "purpose": { "en": "Owns the Wiki workspace", "zh-CN": "负责 Wiki 工作区" },
      "domain_state": "materialized",
      "scope": { "includes": ["wiki workspace"], "excludes": [] },
      "parent_id": null,
      "relationships": [],
      "evidence_refs": ["test:wiki-layout"],
      "known_gaps": [],
      "paired_assets": {
        "en": "wiki-workspace-en.md",
        "zh-CN": "wiki-workspace.md"
      },
      "baseline": "abc123"
    }
  ]
}
