{
  "schema_version": 1,
  "project_id": "sample-app",
  "identity_lineage": [],
  "repositories": [],
  "constraints": [],
  "domains": [{
    "id": "desktop-experience",
    "kind": "domain",
    "label": { "en": "Desktop experience", "zh-CN": "桌面体验" },
    "purpose": { "en": "Owns desktop interaction", "zh-CN": "负责桌面交互" },
    "domain_state": "materialized",
    "scope": { "includes": ["desktop interaction"], "excludes": [] },
    "parent_id": null,
    "relationships": [],
    "evidence_refs": [],
    "known_gaps": []
  }]
}
