{
  "schema_version": 1,
  "project_id": "sample-app",
  "identity_lineage": [],
  "repositories": [],
  "constraints": [{
    "id": "cycle-selection",
    "scope": "selected_descendants",
    "owner_id": "root-domain",
    "selected_descendants": ["cycle-a"]
  }],
  "domains": [
    {
      "id": "root-domain",
      "kind": "domain",
      "label": { "en": "Root", "zh-CN": "根" },
      "purpose": { "en": "Root domain", "zh-CN": "根领域" },
      "domain_state": "confirmed",
      "scope": { "includes": ["root"], "excludes": [] },
      "parent_id": null,
      "relationships": [],
      "evidence_refs": [],
      "known_gaps": []
    },
    {
      "id": "cycle-a",
      "kind": "domain",
      "label": { "en": "Cycle A", "zh-CN": "循环甲" },
      "purpose": { "en": "Cycle A", "zh-CN": "循环甲" },
      "domain_state": "confirmed",
      "scope": { "includes": ["a"], "excludes": [] },
      "parent_id": "cycle-b",
      "relationships": [],
      "evidence_refs": [],
      "known_gaps": []
    },
    {
      "id": "cycle-b",
      "kind": "domain",
      "label": { "en": "Cycle B", "zh-CN": "循环乙" },
      "purpose": { "en": "Cycle B", "zh-CN": "循环乙" },
      "domain_state": "confirmed",
      "scope": { "includes": ["a", "b"], "excludes": [] },
      "parent_id": "cycle-a",
      "relationships": [],
      "evidence_refs": [],
      "known_gaps": []
    }
  ]
}
